{"schemaVersion":1,"id":"01M4B1BH0PP0T4RP5TEAFSHG8P","createdAt":"2026-10-07T11:18:07.633Z","updatedAt":"2026-10-08T11:38:08.823Z","authors":[],
"ops":[
{"id":"01M4B1BH0H0ETGC9G2DMCK21SK","type":"import","author":"me","ts":"2026-10-07T11:18:07.633Z","text":"# Welcome to shoulder-md\n\nA Markdown editor with Word-style **tracked changes**. Underneath, every edit is recorded as an operation on a sentence-level model, so nothing about a document's editing history is lost.\n\n- Turn on **Track changes** in the toolbar (⌘⌥T) and edit this paragraph: deletions stay struck through, insertions are underlined, and a card appears in the margin.\n- Accept or reject a change from its card, or with ⌘⌥A and ⌘⌥R while the cursor is in it. ⌘⌥N and ⌘⌥P jump between changes.\n- Add a reason to a change from its card. Reasons are the point: the library of edits with reasons is what will teach Claude to edit like you.\n- Switch between **Markup**, **Clean**, and **Original** views to see the document with changes shown, applied, or rejected.\n- Everything is saved in the background, in this browser. Open **Settings** (⌘,) for fonts, themes, and your author name.\n\n> Comments, exports, and the edits library arrive in the next phases. See plan.md in the repo.\n","alloc":{"sentenceIds":["01M4B1BH0PH7J70QQED0NHGESF","01M4B1BH0PGCBEF0ACK5XJ8217","01M4B1BH0PB3GZNXNG0GBGA78B","01M4B1BH0PQJ9YEJD83EDRRAGV","01M4B1BH0PMXDNK0HCNZWM856H","01M4B1BH0PS4CQG4QVT4EHQC4N","01M4B1BH0P043WF9QZSKH5RACF","01M4B1BH0P9KVZSXTR99D7P918","01M4B1BH0PJA5F7K8HYSRGTHQH","01M4B1BH0PXWTRQ0MVDDRKAQ5S","01M4B1BH0PG2WRV3EPPZSKTR3T","01M4B1BH0PV2XK83D577VHQDR5","01M4B1BH0PNMVSV301WSQPCS2E"],"blockIds":["01M4B1BH0PAYCHS0H47JCDYBCB","01M4B1BH0PJY9SQMGD8NRYTR8M","01M4B1BH0PEH2PBRF2Z1P8CJME","01M4B1BH0PC2EEAX26FYV2309V","01M4B1BH0P75FV65MEXY124YFA","01M4B1BH0PH51W5EGHY6VC485V","01M4B1BH0PP5AVPNACD0Z93XEW","01M4B1BH0PD24STBKH811X12BP"]},"effects":[{"kind":"sentence_added","sentenceId":"01M4B1BH0PH7J70QQED0NHGESF"},{"kind":"sentence_added","sentenceId":"01M4B1BH0PGCBEF0ACK5XJ8217"},{"kind":"sentence_added","sentenceId":"01M4B1BH0PB3GZNXNG0GBGA78B"},{"kind":"sentence_added","sentenceId":"01M4B1BH0PQJ9YEJD83EDRRAGV"},{"kind":"sentence_added","sentenceId":"01M4B1BH0PMXDNK0HCNZWM856H"},{"kind":"sentence_added","sentenceId":"01M4B1BH0PS4CQG4QVT4EHQC4N"},{"kind":"sentence_added","sentenceId":"01M4B1BH0P043WF9QZSKH5RACF"},{"kind":"sentence_added","sentenceId":"01M4B1BH0P9KVZSXTR99D7P918"},{"kind":"sentence_added","sentenceId":"01M4B1BH0PJA5F7K8HYSRGTHQH"},{"kind":"sentence_added","sentenceId":"01M4B1BH0PXWTRQ0MVDDRKAQ5S"},{"kind":"sentence_added","sentenceId":"01M4B1BH0PG2WRV3EPPZSKTR3T"},{"kind":"sentence_added","sentenceId":"01M4B1BH0PV2XK83D577VHQDR5"},{"kind":"sentence_added","sentenceId":"01M4B1BH0PNMVSV301WSQPCS2E"},{"kind":"block_added","blockId":"01M4B1BH0PAYCHS0H47JCDYBCB"},{"kind":"block_added","blockId":"01M4B1BH0PJY9SQMGD8NRYTR8M"},{"kind":"block_added","blockId":"01M4B1BH0PEH2PBRF2Z1P8CJME"},{"kind":"block_added","blockId":"01M4B1BH0PC2EEAX26FYV2309V"},{"kind":"block_added","blockId":"01M4B1BH0P75FV65MEXY124YFA"},{"kind":"block_added","blockId":"01M4B1BH0PH51W5EGHY6VC485V"},{"kind":"block_added","blockId":"01M4B1BH0PP5AVPNACD0Z93XEW"},{"kind":"block_added","blockId":"01M4B1BH0PD24STBKH811X12BP"}]},
{"id":"01M4B1BH0PGE9QR986WQRQHV4R","type":"set_tracking","author":"me","ts":"2026-10-07T11:18:07.633Z","on":false},
{"id":"01M4DJD0HJVWFFCW9TDRRKNVEX","type":"edit","author":"me","ts":"2026-10-08T10:54:30.961Z","changeId":"01M4DJD0HJ67PZTMEK2RR71X2G","from":{"sentenceId":"01M4B1BH0PH7J70QQED0NHGESF","offset":23},"to":{"sentenceId":"01M4B1BH0PH7J70QQED0NHGESF","offset":24},"insert":"","tracked":false,"alloc":{"sentenceIds":[],"blockIds":[]},"effects":[]},
{"id":"01M4DJD0NR0NVH4N4NWFY26M1J","type":"edit","author":"me","ts":"2026-10-08T10:54:31.096Z","changeId":"01M4DJD0HJ67PZTMEK2RR71X2G","from":{"sentenceId":"01M4B1BH0PH7J70QQED0NHGESF","offset":22},"to":{"sentenceId":"01M4B1BH0PH7J70QQED0NHGESF","offset":23},"insert":"","tracked":false,"alloc":{"sentenceIds":[],"blockIds":[]},"effects":[]},
{"id":"01M4DJD0S7PCQ5SCYBWKYB115C","type":"edit","author":"me","ts":"2026-10-08T10:54:31.207Z","changeId":"01M4DJD0HJ67PZTMEK2RR71X2G","from":{"sentenceId":"01M4B1BH0PH7J70QQED0NHGESF","offset":21},"to":{"sentenceId":"01M4B1BH0PH7J70QQED0NHGESF","offset":22},"insert":"","tracked":false,"alloc":{"sentenceIds":[],"blockIds":[]},"effects":[]},
{"id":"01M4DJDF9XM9XTXXHN9CZJS7PF","type":"edit","author":"me","ts":"2026-10-08T10:54:46.077Z","changeId":"01M4DJDF9XA4X16C71V38R3WPN","from":{"sentenceId":"01M4B1BH0PGCBEF0ACK5XJ8217","offset":0},"to":{"sentenceId":"01M4B1BH0PGCBEF0ACK5XJ8217","offset":0},"insert":"\n\n\n","tracked":false,"alloc":{"sentenceIds":[],"blockIds":[]},"effects":[]},
{"id":"01M4DJDGPVGBFD42BJVSHWF0GM","type":"edit","author":"me","ts":"2026-10-08T10:54:47.515Z","changeId":"01M4DJDGPVD3H2C31G02G2W8GP","from":{"sentenceId":"01M4B1BH0PH7J70QQED0NHGESF","offset":23},"to":{"sentenceId":"01M4B1BH0PH7J70QQED0NHGESF","offset":23},"insert":"T","tracked":false,"alloc":{"sentenceIds":["01M4DJDGPW62YM15X5DV40JKJY"],"blockIds":["01M4DJDGPW3Z0TP6XYYKPN05HG"]},"effects":[{"kind":"split","sentenceId":"01M4B1BH0PH7J70QQED0NHGESF","into":["01M4B1BH0PH7J70QQED0NHGESF","01M4DJDGPW62YM15X5DV40JKJY"]},{"kind":"sentence_added","sentenceId":"01M4DJDGPW62YM15X5DV40JKJY"},{"kind":"block_added","blockId":"01M4DJDGPW3Z0TP6XYYKPN05HG"}]},
{"id":"01M4DJDH1XAHJSCFX73Q8VPKC2","type":"edit","author":"me","ts":"2026-10-08T10:54:47.869Z","changeId":"01M4DJDGPVD3H2C31G02G2W8GP","from":{"sentenceId":"01M4DJDGPW62YM15X5DV40JKJY","offset":0},"to":{"sentenceId":"01M4DJDGPW62YM15X5DV40JKJY","offset":1},"insert":"","tracked":false,"alloc":{"sentenceIds":[],"blockIds":[]},"effects":[{"kind":"merge","sentenceIds":["01M4B1BH0PH7J70QQED0NHGESF","01M4DJDGPW62YM15X5DV40JKJY"],"into":"01M4B1BH0PH7J70QQED0NHGESF"},{"kind":"sentence_removed","sentenceId":"01M4DJDGPW62YM15X5DV40JKJY"},{"kind":"block_removed","blockId":"01M4DJDGPW3Z0TP6XYYKPN05HG"}]},
{"id":"01M4DJDHGXDWQMF82YB3050VBC","type":"edit","author":"me","ts":"2026-10-08T10:54:48.349Z","changeId":"01M4DJDGPVD3H2C31G02G2W8GP","from":{"sentenceId":"01M4B1BH0PH7J70QQED0NHGESF","offset":22},"to":{"sentenceId":"01M4B1BH0PH7J70QQED0NHGESF","offset":23},"insert":"\nThis is a mardown editor with tracked changes","tracked":false,"alloc":{"sentenceIds":["01M4DJDJ8PG1Q40SKBYKCEMWBB"],"blockIds":["01M4DJDJ8PMVVTM42JV5B7H186"]},"effects":[{"kind":"split","sentenceId":"01M4B1BH0PH7J70QQED0NHGESF","into":["01M4B1BH0PH7J70QQED0NHGESF","01M4DJDJ8PG1Q40SKBYKCEMWBB"]},{"kind":"sentence_added","sentenceId":"01M4DJDJ8PG1Q40SKBYKCEMWBB"},{"kind":"block_added","blockId":"01M4DJDJ8PMVVTM42JV5B7H186"}]},
{"id":"01M4DJE50XSFW9CDSER4EYWK36","type":"edit","author":"me","ts":"2026-10-08T10:55:08.316Z","changeId":"01M4DJE50WBPP2WGV7XC93PFQK","from":{"sentenceId":"01M4DJDJ8PG1Q40SKBYKCEMWBB","offset":45},"to":{"sentenceId":"01M4DJDJ8PG1Q40SKBYKCEMWBB","offset":45},"insert":". It is also a personal experiment","tracked":false,"alloc":{"sentenceIds":["01M4DJE5J6R2MV50P1PB6366N1"],"blockIds":[]},"effects":[{"kind":"split","sentenceId":"01M4DJDJ8PG1Q40SKBYKCEMWBB","into":["01M4DJDJ8PG1Q40SKBYKCEMWBB","01M4DJE5J6R2MV50P1PB6366N1"]},{"kind":"sentence_added","sentenceId":"01M4DJE5J6R2MV50P1PB6366N1"}]},
{"id":"01M4DJEZP47VER5R27GKH8R33F","type":"edit","author":"me","ts":"2026-10-08T10:55:35.620Z","changeId":"01M4DJEZP41RMQ71W9XT6J3YQG","from":{"sentenceId":"01M4DJE5J6R2MV50P1PB6366N1","offset":12},"to":{"sentenceId":"01M4DJE5J6R2MV50P1PB6366N1","offset":13},"insert":"","tracked":false,"alloc":{"sentenceIds":[],"blockIds":[]},"effects":[]},
{"id":"01M4DJEZX1QVAC9D9K0AHPCGFZ","type":"edit","author":"me","ts":"2026-10-08T10:55:35.841Z","changeId":"01M4DJEZP41RMQ71W9XT6J3YQG","from":{"sentenceId":"01M4DJE5J6R2MV50P1PB6366N1","offset":11},"to":{"sentenceId":"01M4DJE5J6R2MV50P1PB6366N1","offset":12},"insert":"","tracked":false,"alloc":{"sentenceIds":[],"blockIds":[]},"effects":[]},
{"id":"01M4DJF0R3NJ69GQYGDAC07WHG","type":"edit","author":"me","ts":"2026-10-08T10:55:36.706Z","changeId":"01M4DJEZP41RMQ71W9XT6J3YQG","from":{"sentenceId":"01M4DJE5J6R2MV50P1PB6366N1","offset":10},"to":{"sentenceId":"01M4DJE5J6R2MV50P1PB6366N1","offset":11},"insert":" ","tracked":false,"alloc":{"sentenceIds":[],"blockIds":[]},"effects":[]},
{"id":"01M4DJF2WZM7DE35J77384A7VK","type":"edit","author":"me","ts":"2026-10-08T10:55:38.911Z","changeId":"01M4DJF2WZGV14Y8S5WTWMG9BW","from":{"sentenceId":"01M4DJE5J6R2MV50P1PB6366N1","offset":30},"to":{"sentenceId":"01M4DJE5J6R2MV50P1PB6366N1","offset":30},"insert":"al","tracked":false,"alloc":{"sentenceIds":[],"blockIds":[]},"effects":[]},
{"id":"01M4DJF6Y8GJGMFJK1SX0T77YR","type":"edit","author":"me","ts":"2026-10-08T10:55:43.048Z","changeId":"01M4DJF6Y8S61YG176ASG33CFM","from":{"sentenceId":"01M4DJE5J6R2MV50P1PB6366N1","offset":11},"to":{"sentenceId":"01M4DJE5J6R2MV50P1PB6366N1","offset":11},"insert":"a ","tracked":false,"alloc":{"sentenceIds":[],"blockIds":[]},"effects":[]},
{"id":"01M4DJF90ECNH84FZNJGGSPN85","type":"edit","author":"me","ts":"2026-10-08T10:55:45.166Z","changeId":"01M4DJF90E41ZEJVJJW5MZPZEJ","from":{"sentenceId":"01M4DJE5J6R2MV50P1PB6366N1","offset":34},"to":{"sentenceId":"01M4DJE5J6R2MV50P1PB6366N1","offset":34},"insert":" tool that ","tracked":false,"alloc":{"sentenceIds":[],"blockIds":[]},"effects":[]},
{"id":"01M4DJFGC44XMX7VQ3HRJRVP9Y","type":"edit","author":"me","ts":"2026-10-08T10:55:52.708Z","changeId":"01M4DJFGC4APZBEVN724Y45YFP","from":{"sentenceId":"01M4DJE5J6R2MV50P1PB6366N1","offset":44},"to":{"sentenceId":"01M4DJE5J6R2MV50P1PB6366N1","offset":45},"insert":"","tracked":false,"alloc":{"sentenceIds":[],"blockIds":[]},"effects":[]},